{
  "option": 6,
  "title": "Say ou tell ? Trois usages.",
  "introText": "Say ou tell ? Choisis.",
  "timing": {
    "introFrames": 90,
    "bodyFrames": 765,
    "outroFrames": 165,
    "pageFrames": 255,
    "answerAt": 165,
    "pauseAt": 45,
    "firstReveal": 150,
    "rowFrames": 90
  },
  "lessonData": {
    "contrast": [
      {
        "before": "She",
        "after": "hello.",
        "answer": "said",
        "choices": [
          "said",
          "told"
        ],
        "en": "She said hello.",
        "fr": "Elle a dit bonjour.",
        "note": "Ici : say + ce qui est dit."
      },
      {
        "before": "She",
        "after": "me a story.",
        "answer": "told",
        "choices": [
          "said",
          "told"
        ],
        "en": "She told me a story.",
        "fr": "Elle m’a raconté une histoire.",
        "note": "Ici : tell + une personne."
      },
      {
        "before": "He",
        "after": "me the truth.",
        "answer": "told",
        "choices": [
          "told",
          "said"
        ],
        "en": "He told me the truth.",
        "fr": "Il m’a dit la vérité.",
        "note": "Retiens : tell someone the truth."
      }
    ]
  },
  "narration": [
    {
      "start": 3,
      "text": "Say ou tell ? Choisis.",
      "voice": "fr-FR-DeniseNeural",
      "role": "intro",
      "duration": 78,
      "src": "audio/production/34576f2174ad045b.wav",
      "peaks": [
        0.0,
        0.0002,
        0.0002,
        0.0816,
        0.4184,
        0.5632,
        0.356,
        1.0,
        0.8181,
        0.6451,
        0.6822,
        0.3443,
        0.007,
        0.3679,
        0.711,
        0.4488,
        0.2593,
        0.1697,
        0.1585,
        0.0646,
        0.0258,
        0.0045,
        0.0004,
        0.0001,
        0.0001,
        0.0001,
        0.0001,
        0.0001,
        0.0001,
        0.0001,
        0.0001,
        0.0001,
        0.0001,
        0.0001,
        0.0001,
        0.0001,
        0.0001,
        0.0002,
        0.0002,
        0.0001,
        0.0002,
        0.0002,
        0.0002,
        0.0755,
        0.3256,
        0.4789,
        0.1987,
        0.8177,
        0.9011,
        0.6944,
        0.3632,
        0.4683,
        0.3661,
        0.2797,
        0.1733,
        0.0571,
        0.0202,
        0.0035,
        0.0001,
        0.0001
      ]
    },
    {
      "start": 266,
      "duration": 41,
      "src": "audio/production/2b45d8713815b5cb.wav",
      "text": "She said hello.",
      "peaks": [
        0.0,
        0.0,
        0.0001,
        0.0001,
        0.0001,
        0.0002,
        0.016,
        0.1322,
        0.222,
        0.3534,
        0.421,
        0.2237,
        0.3639,
        0.9991,
        1.0,
        0.7567,
        0.2883,
        0.2724,
        0.2674,
        0.2748,
        0.2401,
        0.346,
        0.7906,
        0.7093,
        0.6266,
        0.5404,
        0.2467,
        0.0388,
        0.1186,
        0.0549,
        0.1029,
        0.117,
        0.1856,
        0.3835,
        0.5703,
        0.5352,
        0.5766,
        0.6238,
        0.6435,
        0.5932,
        0.6155,
        0.5819,
        0.5611,
        0.4641,
        0.4333,
        0.3653,
        0.2826,
        0.2449,
        0.1937,
        0.1512,
        0.1291,
        0.0718,
        0.0397,
        0.0131,
        0.0045,
        0.0013,
        0.0003,
        0.0002,
        0.0001,
        0.0001
      ],
      "voice": "en-GB-SoniaNeural",
      "role": "lesson"
    },
    {
      "start": 521,
      "duration": 51,
      "src": "audio/production/901e528f8a91435c.wav",
      "text": "She told me a story.",
      "peaks": [
        0.0,
        0.0,
        0.0001,
        0.0002,
        0.0003,
        0.0493,
        0.19,
        0.3679,
        0.3303,
        0.4765,
        0.8659,
        0.4617,
        0.019,
        0.2111,
        0.2023,
        0.1471,
        0.5054,
        0.8259,
        0.7981,
        0.7314,
        0.7201,
        0.6669,
        0.1825,
        0.1291,
        0.1473,
        0.736,
        0.9456,
        0.8256,
        0.7443,
        0.6837,
        0.6289,
        0.5834,
        0.4181,
        0.2997,
        0.337,
        0.3681,
        0.3763,
        0.0669,
        0.1103,
        0.7162,
        1.0,
        0.8237,
        0.7717,
        0.7312,
        0.6647,
        0.5679,
        0.4794,
        0.4537,
        0.3763,
        0.3522,
        0.3074,
        0.2382,
        0.161,
        0.0883,
        0.0209,
        0.0026,
        0.0005,
        0.0003,
        0.0002,
        0.0002
      ],
      "voice": "en-GB-SoniaNeural",
      "role": "lesson"
    },
    {
      "start": 776,
      "duration": 50,
      "src": "audio/production/51c8ca870b948aed.wav",
      "text": "He told me the truth.",
      "peaks": [
        0.0,
        0.0001,
        0.0001,
        0.0001,
        0.0036,
        0.0178,
        0.4544,
        0.9156,
        1.0,
        0.2349,
        0.0129,
        0.2647,
        0.2793,
        0.1314,
        0.4616,
        0.855,
        0.9259,
        0.8279,
        0.8065,
        0.7854,
        0.3061,
        0.131,
        0.1382,
        0.6161,
        0.9373,
        0.8834,
        0.7698,
        0.6969,
        0.5999,
        0.1631,
        0.0432,
        0.5322,
        0.6217,
        0.1792,
        0.0082,
        0.152,
        0.6353,
        0.3805,
        0.1756,
        0.2079,
        0.8302,
        0.8526,
        0.864,
        0.785,
        0.6086,
        0.362,
        0.1903,
        0.0771,
        0.0441,
        0.0386,
        0.0346,
        0.0317,
        0.0327,
        0.0282,
        0.0162,
        0.0087,
        0.0013,
        0.0004,
        0.0002,
        0.0001
      ],
      "voice": "en-GB-SoniaNeural",
      "role": "lesson"
    },
    {
      "start": 861,
      "duration": 130,
      "src": "audio/production/07fe07394dca2591.wav",
      "text": "Bravo, tu as terminé cet exercice ! À bientôt !",
      "voice": "fr-FR-DeniseNeural",
      "peaks": [
        0.0002,
        0.0002,
        0.3088,
        0.4855,
        0.9756,
        0.468,
        0.4658,
        1.0,
        0.2724,
        0.0021,
        0.0002,
        0.0003,
        0.0006,
        0.1857,
        0.9098,
        0.8677,
        0.0703,
        0.7239,
        0.5711,
        0.8369,
        0.7797,
        0.7245,
        0.5527,
        0.7178,
        0.576,
        0.0928,
        0.5061,
        0.429,
        0.5351,
        0.4088,
        0.5506,
        0.5325,
        0.3779,
        0.6329,
        0.5989,
        0.1552,
        0.0162,
        0.0002,
        0.0001,
        0.0,
        0.0,
        0.0,
        0.0,
        0.0,
        0.0,
        0.0,
        0.0,
        0.0,
        0.0002,
        0.0003,
        0.9492,
        0.5837,
        0.3841,
        0.7765,
        0.3852,
        0.2796,
        0.7472,
        0.0995,
        0.0099,
        0.0002
      ],
      "role": "outro"
    }
  ]
}
