{
  "option": 12,
  "title": "Un modèle, deux essais.",
  "introText": "Un modèle, puis à toi.",
  "timing": {
    "introFrames": 90,
    "bodyFrames": 765,
    "outroFrames": 165,
    "pageFrames": 255,
    "answerAt": 165,
    "pauseAt": 45,
    "firstReveal": 150,
    "rowFrames": 90
  },
  "lessonData": {
    "transfer": [
      {
        "en": "Can you do me a favor?",
        "fr": "Tu peux me rendre un service ?",
        "prompt": "do a favor",
        "note": "Le groupe à retenir."
      },
      {
        "en": "I do my homework.",
        "fr": "Je fais mes devoirs.",
        "prompt": "I ___ my homework.",
        "note": "do my homework"
      },
      {
        "en": "I do the dishes.",
        "fr": "Je fais la vaisselle.",
        "prompt": "I ___ the dishes.",
        "note": "do the dishes"
      }
    ]
  },
  "narration": [
    {
      "start": 3,
      "text": "Un modèle, puis à toi.",
      "voice": "fr-FR-DeniseNeural",
      "role": "intro",
      "duration": 55,
      "src": "audio/production/4b8cbd4b60200dc8.wav",
      "peaks": [
        0.0,
        0.0002,
        0.0001,
        0.0001,
        0.0016,
        0.6119,
        0.9173,
        1.0,
        0.6658,
        0.6591,
        0.7435,
        0.6581,
        0.7175,
        0.7965,
        0.2471,
        0.1373,
        0.3145,
        0.9021,
        0.839,
        0.6277,
        0.6076,
        0.5489,
        0.5012,
        0.4789,
        0.4768,
        0.3888,
        0.1436,
        0.0107,
        0.002,
        0.0016,
        0.0008,
        0.0006,
        0.0003,
        0.0003,
        0.0004,
        0.0006,
        0.0527,
        0.1071,
        0.2197,
        0.3837,
        0.6406,
        0.6484,
        0.6076,
        0.3961,
        0.038,
        0.0038,
        0.2464,
        0.096,
        0.0723,
        0.5062,
        0.6302,
        0.4494,
        0.1931,
        0.0887,
        0.0291,
        0.0072,
        0.0005,
        0.0002,
        0.0002,
        0.0001
      ]
    },
    {
      "start": 163,
      "duration": 49,
      "src": "audio/production/d8fa3b10c6b571a3.wav",
      "text": "Can you do me a favor?",
      "peaks": [
        0.0,
        0.0,
        0.0001,
        0.0001,
        0.0001,
        0.0556,
        0.0892,
        0.2409,
        0.6693,
        0.8586,
        0.9231,
        0.8777,
        0.8721,
        0.9338,
        0.9468,
        0.9785,
        1.0,
        0.3601,
        0.0472,
        0.1938,
        0.5236,
        0.7207,
        0.7762,
        0.7568,
        0.7939,
        0.814,
        0.7773,
        0.6666,
        0.6472,
        0.5518,
        0.5186,
        0.4191,
        0.1684,
        0.0531,
        0.0354,
        0.034,
        0.0272,
        0.1424,
        0.5554,
        0.5162,
        0.4963,
        0.5642,
        0.5422,
        0.5856,
        0.1721,
        0.033,
        0.0531,
        0.2537,
        0.2501,
        0.2075,
        0.1789,
        0.1593,
        0.1166,
        0.0618,
        0.0134,
        0.0026,
        0.0005,
        0.0003,
        0.0001,
        0.0001
      ],
      "voice": "en-GB-SoniaNeural",
      "role": "lesson"
    },
    {
      "start": 521,
      "duration": 45,
      "src": "audio/production/324c3c7d5b7914d7.wav",
      "text": "I do my homework.",
      "peaks": [
        0.0,
        0.0,
        0.0001,
        0.0001,
        0.0001,
        0.0017,
        0.3292,
        0.5016,
        0.6098,
        0.7486,
        0.8148,
        0.2764,
        0.0327,
        0.2003,
        0.5801,
        0.8114,
        0.9283,
        0.9086,
        0.8288,
        1.0,
        0.9866,
        0.5938,
        0.6267,
        0.6526,
        0.6892,
        0.6579,
        0.4468,
        0.2137,
        0.1477,
        0.2083,
        0.4129,
        0.6035,
        0.6701,
        0.7444,
        0.7419,
        0.765,
        0.758,
        0.71,
        0.6143,
        0.5259,
        0.4968,
        0.4104,
        0.3203,
        0.2444,
        0.2094,
        0.1564,
        0.0961,
        0.0788,
        0.0159,
        0.0016,
        0.0007,
        0.0023,
        0.0323,
        0.0182,
        0.0114,
        0.0044,
        0.001,
        0.0003,
        0.0001,
        0.0001
      ],
      "voice": "en-GB-SoniaNeural",
      "role": "lesson"
    },
    {
      "start": 776,
      "duration": 45,
      "src": "audio/production/93a5eb5637396928.wav",
      "text": "I do the dishes.",
      "peaks": [
        0.0,
        0.0,
        0.0001,
        0.0001,
        0.0001,
        0.0005,
        0.2281,
        0.4865,
        0.5602,
        0.6591,
        0.7707,
        0.6121,
        0.1963,
        0.0161,
        0.2044,
        0.4346,
        0.7794,
        0.945,
        1.0,
        0.9188,
        0.806,
        0.2214,
        0.0369,
        0.0818,
        0.7829,
        0.7254,
        0.4335,
        0.0806,
        0.0091,
        0.1773,
        0.5496,
        0.8913,
        0.7534,
        0.4331,
        0.2396,
        0.3597,
        0.3341,
        0.3717,
        0.2521,
        0.235,
        0.3846,
        0.3899,
        0.3278,
        0.2516,
        0.2196,
        0.1259,
        0.0819,
        0.0948,
        0.1058,
        0.1308,
        0.1296,
        0.1135,
        0.0761,
        0.0294,
        0.0069,
        0.0022,
        0.0005,
        0.0002,
        0.0001,
        0.0001
      ],
      "voice": "en-GB-SoniaNeural",
      "role": "lesson"
    },
    {
      "start": 861,
      "duration": 130,
      "src": "audio/production/07fe07394dca2591.wav",
      "text": "Bravo, tu as terminé cet exercice ! À bientôt !",
      "voice": "fr-FR-DeniseNeural",
      "peaks": [
        0.0002,
        0.0002,
        0.3088,
        0.4855,
        0.9756,
        0.468,
        0.4658,
        1.0,
        0.2724,
        0.0021,
        0.0002,
        0.0003,
        0.0006,
        0.1857,
        0.9098,
        0.8677,
        0.0703,
        0.7239,
        0.5711,
        0.8369,
        0.7797,
        0.7245,
        0.5527,
        0.7178,
        0.576,
        0.0928,
        0.5061,
        0.429,
        0.5351,
        0.4088,
        0.5506,
        0.5325,
        0.3779,
        0.6329,
        0.5989,
        0.1552,
        0.0162,
        0.0002,
        0.0001,
        0.0,
        0.0,
        0.0,
        0.0,
        0.0,
        0.0,
        0.0,
        0.0,
        0.0,
        0.0002,
        0.0003,
        0.9492,
        0.5837,
        0.3841,
        0.7765,
        0.3852,
        0.2796,
        0.7472,
        0.0995,
        0.0099,
        0.0002
      ],
      "role": "outro"
    }
  ]
}
