{
  "option": 11,
  "title": "Trois phrases à retrouver.",
  "introText": "Retrouve la phrase en anglais.",
  "timing": {
    "introFrames": 90,
    "bodyFrames": 765,
    "outroFrames": 165,
    "pageFrames": 255,
    "answerAt": 165,
    "pauseAt": 45,
    "firstReveal": 150,
    "rowFrames": 90
  },
  "lessonData": {
    "recall": [
      {
        "en": "Could you help me?",
        "fr": "Tu pourrais m’aider ?"
      },
      {
        "en": "Could you say that again?",
        "fr": "Tu pourrais répéter ?"
      },
      {
        "en": "Where is the station?",
        "fr": "Où est la gare ?"
      }
    ]
  },
  "narration": [
    {
      "start": 3,
      "text": "Retrouve la phrase en anglais.",
      "voice": "fr-FR-DeniseNeural",
      "role": "intro",
      "duration": 52,
      "src": "audio/production/ed16c2bbc703420f.wav",
      "peaks": [
        0.0,
        0.0,
        0.0,
        0.0003,
        0.0002,
        0.0666,
        0.2141,
        0.1994,
        0.2928,
        0.7843,
        1.0,
        0.3938,
        0.0123,
        0.1375,
        0.1253,
        0.0783,
        0.2202,
        0.7915,
        0.6346,
        0.2469,
        0.1676,
        0.2845,
        0.4642,
        0.7004,
        0.6656,
        0.4303,
        0.0908,
        0.0766,
        0.0856,
        0.1364,
        0.14,
        0.297,
        0.8306,
        0.823,
        0.524,
        0.3145,
        0.3229,
        0.3656,
        0.545,
        0.6401,
        0.5477,
        0.5238,
        0.581,
        0.8026,
        0.7659,
        0.7093,
        0.6212,
        0.1979,
        0.2556,
        0.3659,
        0.42,
        0.3536,
        0.2655,
        0.1474,
        0.0286,
        0.0091,
        0.0028,
        0.0007,
        0.0003,
        0.0002
      ]
    },
    {
      "start": 266,
      "duration": 39,
      "src": "audio/production/b111db3a320999a1.wav",
      "text": "Could you help me?",
      "peaks": [
        0.0,
        0.0,
        0.0001,
        0.0001,
        0.0002,
        0.0002,
        0.0025,
        0.2217,
        0.1059,
        0.5378,
        1.0,
        0.7914,
        0.2832,
        0.0478,
        0.1873,
        0.221,
        0.2967,
        0.7822,
        0.9549,
        0.9348,
        0.812,
        0.7024,
        0.4751,
        0.2564,
        0.1486,
        0.148,
        0.1791,
        0.3232,
        0.5167,
        0.559,
        0.5614,
        0.5065,
        0.5248,
        0.3182,
        0.0211,
        0.0034,
        0.002,
        0.0012,
        0.004,
        0.0145,
        0.2086,
        0.508,
        0.5487,
        0.5922,
        0.5766,
        0.4935,
        0.4585,
        0.4061,
        0.3214,
        0.2492,
        0.1826,
        0.0898,
        0.0225,
        0.0045,
        0.001,
        0.0004,
        0.0004,
        0.0004,
        0.0002,
        0.0001
      ],
      "voice": "en-GB-SoniaNeural",
      "role": "lesson"
    },
    {
      "start": 521,
      "duration": 50,
      "src": "audio/production/a7e31fbd467fd9de.wav",
      "text": "Could you say that again?",
      "peaks": [
        0.0,
        0.0,
        0.0001,
        0.0002,
        0.0002,
        0.0858,
        0.1066,
        0.475,
        0.8919,
        0.343,
        0.0954,
        0.1939,
        0.3813,
        0.7654,
        1.0,
        0.8484,
        0.3853,
        0.2997,
        0.355,
        0.3327,
        0.3069,
        0.2751,
        0.7344,
        0.7016,
        0.6673,
        0.6091,
        0.6531,
        0.3409,
        0.0429,
        0.3936,
        0.4777,
        0.4,
        0.3525,
        0.3026,
        0.1447,
        0.0311,
        0.167,
        0.0806,
        0.3672,
        0.2085,
        0.0253,
        0.0989,
        0.359,
        0.4962,
        0.4729,
        0.4492,
        0.3835,
        0.3556,
        0.2974,
        0.2636,
        0.2193,
        0.2037,
        0.162,
        0.0923,
        0.0216,
        0.0039,
        0.0005,
        0.0003,
        0.0002,
        0.0002
      ],
      "voice": "en-GB-SoniaNeural",
      "role": "lesson"
    },
    {
      "start": 776,
      "duration": 45,
      "src": "audio/production/74d2818bb7ab3d83.wav",
      "text": "Where is the station?",
      "peaks": [
        0.0,
        0.0001,
        0.0002,
        0.0002,
        0.0002,
        0.0012,
        0.2971,
        0.5487,
        0.956,
        0.9251,
        0.7825,
        0.8106,
        0.8302,
        0.807,
        0.7957,
        0.9174,
        0.9971,
        0.8986,
        0.4083,
        0.3754,
        0.1997,
        0.0467,
        0.0094,
        0.0466,
        0.8158,
        1.0,
        0.4877,
        0.3781,
        0.4092,
        0.4784,
        0.3292,
        0.0338,
        0.2301,
        0.8452,
        0.8942,
        0.7829,
        0.7979,
        0.7109,
        0.5587,
        0.2506,
        0.3412,
        0.5202,
        0.5775,
        0.5091,
        0.2128,
        0.438,
        0.5082,
        0.4449,
        0.3661,
        0.2828,
        0.2493,
        0.1969,
        0.1501,
        0.0513,
        0.0075,
        0.0012,
        0.0006,
        0.0004,
        0.0002,
        0.0002
      ],
      "voice": "en-GB-SoniaNeural",
      "role": "lesson"
    },
    {
      "start": 861,
      "duration": 130,
      "src": "audio/production/07fe07394dca2591.wav",
      "text": "Bravo, tu as terminé cet exercice ! À bientôt !",
      "voice": "fr-FR-DeniseNeural",
      "peaks": [
        0.0002,
        0.0002,
        0.3088,
        0.4855,
        0.9756,
        0.468,
        0.4658,
        1.0,
        0.2724,
        0.0021,
        0.0002,
        0.0003,
        0.0006,
        0.1857,
        0.9098,
        0.8677,
        0.0703,
        0.7239,
        0.5711,
        0.8369,
        0.7797,
        0.7245,
        0.5527,
        0.7178,
        0.576,
        0.0928,
        0.5061,
        0.429,
        0.5351,
        0.4088,
        0.5506,
        0.5325,
        0.3779,
        0.6329,
        0.5989,
        0.1552,
        0.0162,
        0.0002,
        0.0001,
        0.0,
        0.0,
        0.0,
        0.0,
        0.0,
        0.0,
        0.0,
        0.0,
        0.0,
        0.0002,
        0.0003,
        0.9492,
        0.5837,
        0.3841,
        0.7765,
        0.3852,
        0.2796,
        0.7472,
        0.0995,
        0.0099,
        0.0002
      ],
      "role": "outro"
    }
  ]
}
