{
  "option": 8,
  "title": "Trois erreurs à corriger.",
  "introText": "Corrige ces phrases.",
  "timing": {
    "introFrames": 90,
    "bodyFrames": 765,
    "outroFrames": 165,
    "pageFrames": 255,
    "answerAt": 165,
    "pauseAt": 45,
    "firstReveal": 150,
    "rowFrames": 90
  },
  "lessonData": {
    "corrections": [
      {
        "before": "I am agree.",
        "en": "I agree.",
        "fr": "Je suis d’accord.",
        "note": "agree est déjà un verbe."
      },
      {
        "before": "She have a cat.",
        "en": "She has a cat.",
        "fr": "Elle a un chat.",
        "note": "Avec she : has, au présent."
      },
      {
        "before": "I have 20 years.",
        "en": "I am twenty years old.",
        "fr": "J’ai vingt ans.",
        "note": "Pour l’âge, on utilise be."
      }
    ]
  },
  "narration": [
    {
      "start": 3,
      "text": "Corrige ces phrases.",
      "voice": "fr-FR-DeniseNeural",
      "role": "intro",
      "duration": 43,
      "src": "audio/production/c7ec04c12f484749.wav",
      "peaks": [
        0.0,
        0.0,
        0.0002,
        0.0001,
        0.0001,
        0.0002,
        0.1177,
        0.1976,
        0.7979,
        1.0,
        0.8106,
        0.5881,
        0.258,
        0.2247,
        0.5331,
        0.5797,
        0.6128,
        0.561,
        0.5113,
        0.3448,
        0.3024,
        0.3779,
        0.3314,
        0.3472,
        0.4495,
        0.5957,
        0.5845,
        0.4335,
        0.288,
        0.5109,
        0.3012,
        0.0821,
        0.0739,
        0.0789,
        0.074,
        0.1117,
        0.1246,
        0.1183,
        0.2273,
        0.4026,
        0.42,
        0.3643,
        0.315,
        0.2596,
        0.2263,
        0.2002,
        0.2468,
        0.3127,
        0.2579,
        0.1219,
        0.1213,
        0.1271,
        0.0774,
        0.0251,
        0.0087,
        0.003,
        0.0005,
        0.0002,
        0.0002,
        0.0001
      ]
    },
    {
      "start": 266,
      "duration": 30,
      "src": "audio/production/f99f8e6b704f1d0b.wav",
      "text": "I agree.",
      "peaks": [
        0.0,
        0.0,
        0.0,
        0.0001,
        0.0001,
        0.0001,
        0.0001,
        0.0001,
        0.0011,
        0.2064,
        0.3729,
        0.5182,
        0.5512,
        0.5902,
        0.6617,
        0.75,
        0.8701,
        0.9277,
        0.974,
        0.9348,
        1.0,
        0.9924,
        0.873,
        0.793,
        0.6981,
        0.1354,
        0.0543,
        0.0103,
        0.0027,
        0.2158,
        0.1332,
        0.3959,
        0.7366,
        0.8432,
        0.9387,
        0.8467,
        0.8551,
        0.7782,
        0.7876,
        0.7101,
        0.6881,
        0.5969,
        0.5429,
        0.4519,
        0.3778,
        0.3042,
        0.28,
        0.2213,
        0.1567,
        0.0846,
        0.0421,
        0.0112,
        0.0035,
        0.0013,
        0.0006,
        0.0004,
        0.0002,
        0.0002,
        0.0001,
        0.0001
      ],
      "voice": "en-GB-SoniaNeural",
      "role": "lesson"
    },
    {
      "start": 521,
      "duration": 41,
      "src": "audio/production/a29eb4350826f73c.wav",
      "text": "She has a cat.",
      "peaks": [
        0.0,
        0.0001,
        0.0001,
        0.0001,
        0.0001,
        0.0003,
        0.0267,
        0.1336,
        0.2306,
        0.3375,
        0.3941,
        0.2521,
        0.7224,
        1.0,
        0.8395,
        0.5621,
        0.2669,
        0.2069,
        0.2606,
        0.4567,
        0.6129,
        0.6885,
        0.6036,
        0.2625,
        0.1769,
        0.2226,
        0.3754,
        0.6631,
        0.5585,
        0.1256,
        0.01,
        0.0012,
        0.1416,
        0.1158,
        0.1056,
        0.1784,
        0.3351,
        0.3761,
        0.3704,
        0.4212,
        0.3618,
        0.3058,
        0.2449,
        0.1559,
        0.084,
        0.0154,
        0.0052,
        0.0013,
        0.0006,
        0.0201,
        0.0714,
        0.0573,
        0.0337,
        0.0116,
        0.0025,
        0.0013,
        0.0004,
        0.0002,
        0.0001,
        0.0001
      ],
      "voice": "en-GB-SoniaNeural",
      "role": "lesson"
    },
    {
      "start": 776,
      "duration": 54,
      "src": "audio/production/8b1a8781ea813637.wav",
      "text": "I am twenty years old.",
      "peaks": [
        0.0,
        0.0,
        0.0001,
        0.0001,
        0.0004,
        0.2871,
        0.5563,
        0.6393,
        0.7735,
        0.7828,
        0.7928,
        0.7613,
        0.8686,
        0.8044,
        0.472,
        0.0265,
        0.274,
        0.089,
        0.0641,
        0.0916,
        0.877,
        0.9328,
        0.9473,
        1.0,
        0.6239,
        0.0927,
        0.3327,
        0.1467,
        0.4337,
        0.5925,
        0.4982,
        0.4253,
        0.5515,
        0.5769,
        0.4992,
        0.5398,
        0.4805,
        0.3031,
        0.1694,
        0.2089,
        0.2808,
        0.5587,
        0.4912,
        0.4775,
        0.4365,
        0.3794,
        0.3075,
        0.2531,
        0.1741,
        0.1561,
        0.135,
        0.06,
        0.0442,
        0.0499,
        0.0179,
        0.0073,
        0.0016,
        0.0003,
        0.0001,
        0.0002
      ],
      "voice": "en-GB-SoniaNeural",
      "role": "lesson"
    },
    {
      "start": 861,
      "duration": 130,
      "src": "audio/production/07fe07394dca2591.wav",
      "text": "Bravo, tu as terminé cet exercice ! À bientôt !",
      "voice": "fr-FR-DeniseNeural",
      "peaks": [
        0.0002,
        0.0002,
        0.3088,
        0.4855,
        0.9756,
        0.468,
        0.4658,
        1.0,
        0.2724,
        0.0021,
        0.0002,
        0.0003,
        0.0006,
        0.1857,
        0.9098,
        0.8677,
        0.0703,
        0.7239,
        0.5711,
        0.8369,
        0.7797,
        0.7245,
        0.5527,
        0.7178,
        0.576,
        0.0928,
        0.5061,
        0.429,
        0.5351,
        0.4088,
        0.5506,
        0.5325,
        0.3779,
        0.6329,
        0.5989,
        0.1552,
        0.0162,
        0.0002,
        0.0001,
        0.0,
        0.0,
        0.0,
        0.0,
        0.0,
        0.0,
        0.0,
        0.0,
        0.0,
        0.0002,
        0.0003,
        0.9492,
        0.5837,
        0.3841,
        0.7765,
        0.3852,
        0.2796,
        0.7472,
        0.0995,
        0.0099,
        0.0002
      ],
      "role": "outro"
    }
  ]
}
