{
  "option": 4,
  "title": "Trois phrases à compléter.",
  "introText": "Quel verbe manque ?",
  "timing": {
    "introFrames": 60,
    "bodyFrames": 765,
    "outroFrames": 165,
    "pageFrames": 255,
    "answerAt": 165,
    "pauseAt": 45,
    "firstReveal": 150,
    "rowFrames": 90
  },
  "lessonData": {
    "gap": [
      {
        "before": "I want to",
        "answer": "learn",
        "after": "English.",
        "choices": [
          "learn",
          "teach"
        ],
        "en": "I want to learn English.",
        "fr": "Je veux apprendre l’anglais.",
        "note": "learn = apprendre"
      },
      {
        "before": "Could you",
        "answer": "open",
        "after": "the window?",
        "choices": [
          "close",
          "open"
        ],
        "en": "Could you open the window?",
        "fr": "Tu pourrais ouvrir la fenêtre ?",
        "note": "open = ouvrir"
      },
      {
        "before": "We need to",
        "answer": "leave",
        "after": "now.",
        "choices": [
          "leave",
          "live"
        ],
        "en": "We need to leave now.",
        "fr": "Nous devons partir maintenant.",
        "note": "leave = partir"
      }
    ]
  },
  "narration": [
    {
      "start": 3,
      "text": "Quel verbe manque ?",
      "voice": "fr-FR-DeniseNeural",
      "role": "intro",
      "duration": 39,
      "src": "audio/production/ca41d0b2148080ed.wav",
      "peaks": [
        0.0,
        0.0002,
        0.0002,
        0.0002,
        0.0002,
        0.0002,
        0.0074,
        0.1046,
        1.0,
        0.9835,
        0.9364,
        0.7861,
        0.5819,
        0.4886,
        0.3169,
        0.2044,
        0.2428,
        0.852,
        0.9714,
        0.9615,
        0.9493,
        0.8512,
        0.7097,
        0.3264,
        0.3608,
        0.3238,
        0.2171,
        0.2262,
        0.5847,
        0.8662,
        0.6595,
        0.5959,
        0.654,
        0.6529,
        0.6155,
        0.6132,
        0.763,
        0.8936,
        0.7863,
        0.6842,
        0.5406,
        0.3543,
        0.1873,
        0.0824,
        0.0137,
        0.0023,
        0.0547,
        0.0943,
        0.1028,
        0.0623,
        0.0422,
        0.03,
        0.0245,
        0.0152,
        0.008,
        0.0018,
        0.0004,
        0.0002,
        0.0002,
        0.0002
      ]
    },
    {
      "start": 227,
      "duration": 52,
      "src": "audio/production/9a72beb3d08ca52d.wav",
      "text": "I want to learn English.",
      "peaks": [
        0.0,
        0.0001,
        0.0001,
        0.0001,
        0.0002,
        0.2965,
        0.647,
        0.7613,
        0.9095,
        0.835,
        0.4523,
        0.6449,
        0.9947,
        1.0,
        0.9142,
        0.6312,
        0.3568,
        0.1355,
        0.1897,
        0.3394,
        0.2079,
        0.7595,
        0.6903,
        0.7377,
        0.7311,
        0.7984,
        0.8097,
        0.7938,
        0.7759,
        0.7591,
        0.7385,
        0.7102,
        0.8068,
        0.8294,
        0.8081,
        0.8224,
        0.8766,
        0.8947,
        0.7857,
        0.4906,
        0.1831,
        0.3781,
        0.3916,
        0.3739,
        0.3394,
        0.2629,
        0.187,
        0.1058,
        0.1407,
        0.2414,
        0.2368,
        0.2192,
        0.1926,
        0.1249,
        0.0353,
        0.0055,
        0.0011,
        0.0003,
        0.0002,
        0.0001
      ],
      "voice": "en-GB-SoniaNeural",
      "role": "lesson"
    },
    {
      "start": 482,
      "duration": 51,
      "src": "audio/production/949d83e445e1b63f.wav",
      "text": "Could you open the window?",
      "peaks": [
        0.0,
        0.0,
        0.0001,
        0.0001,
        0.0002,
        0.1319,
        0.0776,
        0.4921,
        0.83,
        0.2674,
        0.0997,
        0.255,
        0.4931,
        0.9671,
        1.0,
        0.8137,
        0.3314,
        0.0659,
        0.1733,
        0.609,
        0.7188,
        0.7969,
        0.6501,
        0.1199,
        0.0043,
        0.0439,
        0.592,
        0.7164,
        0.8968,
        0.8738,
        0.8217,
        0.7268,
        0.7233,
        0.6987,
        0.4151,
        0.3936,
        0.8135,
        0.8084,
        0.8376,
        0.9327,
        0.9851,
        0.9574,
        0.8849,
        0.548,
        0.2542,
        0.4569,
        0.3777,
        0.3421,
        0.2926,
        0.281,
        0.2487,
        0.2164,
        0.1564,
        0.1073,
        0.028,
        0.0022,
        0.0005,
        0.0003,
        0.0002,
        0.0001
      ],
      "voice": "en-GB-SoniaNeural",
      "role": "lesson"
    },
    {
      "start": 737,
      "duration": 45,
      "src": "audio/production/2e80c220ffdbbf3a.wav",
      "text": "We need to leave now.",
      "peaks": [
        0.0,
        0.0,
        0.0001,
        0.0001,
        0.0001,
        0.0004,
        0.318,
        0.5392,
        0.7485,
        0.9169,
        0.9724,
        0.9503,
        1.0,
        0.9618,
        0.9043,
        0.8497,
        0.841,
        0.8012,
        0.5142,
        0.0555,
        0.0027,
        0.3016,
        0.2745,
        0.0897,
        0.5846,
        0.5793,
        0.5364,
        0.6025,
        0.5172,
        0.6964,
        0.7228,
        0.7362,
        0.6796,
        0.6378,
        0.6427,
        0.255,
        0.0605,
        0.0455,
        0.0448,
        0.3276,
        0.4586,
        0.4986,
        0.4317,
        0.3929,
        0.3524,
        0.3333,
        0.3277,
        0.3006,
        0.2631,
        0.2296,
        0.2116,
        0.1663,
        0.1112,
        0.0354,
        0.006,
        0.0015,
        0.0006,
        0.0003,
        0.0002,
        0.0001
      ],
      "voice": "en-GB-SoniaNeural",
      "role": "lesson"
    },
    {
      "start": 831,
      "duration": 130,
      "src": "audio/production/07fe07394dca2591.wav",
      "text": "Bravo, tu as terminé cet exercice ! À bientôt !",
      "voice": "fr-FR-DeniseNeural",
      "peaks": [
        0.0002,
        0.0002,
        0.3088,
        0.4855,
        0.9756,
        0.468,
        0.4658,
        1.0,
        0.2724,
        0.0021,
        0.0002,
        0.0003,
        0.0006,
        0.1857,
        0.9098,
        0.8677,
        0.0703,
        0.7239,
        0.5711,
        0.8369,
        0.7797,
        0.7245,
        0.5527,
        0.7178,
        0.576,
        0.0928,
        0.5061,
        0.429,
        0.5351,
        0.4088,
        0.5506,
        0.5325,
        0.3779,
        0.6329,
        0.5989,
        0.1552,
        0.0162,
        0.0002,
        0.0001,
        0.0,
        0.0,
        0.0,
        0.0,
        0.0,
        0.0,
        0.0,
        0.0,
        0.0,
        0.0002,
        0.0003,
        0.9492,
        0.5837,
        0.3841,
        0.7765,
        0.3852,
        0.2796,
        0.7472,
        0.0995,
        0.0099,
        0.0002
      ],
      "role": "outro"
    }
  ]
}
