{
  "option": 5,
  "title": "Trois phrases au restaurant.",
  "introText": "Que dis-tu au restaurant ?",
  "timing": {
    "introFrames": 90,
    "bodyFrames": 765,
    "outroFrames": 165,
    "pageFrames": 255,
    "answerAt": 165,
    "pauseAt": 45,
    "firstReveal": 150,
    "rowFrames": 90
  },
  "lessonData": {
    "situation": [
      {
        "context": "Le repas est terminé.",
        "choices": [
          "The bill, please.",
          "The addition, please."
        ],
        "answer": 0,
        "en": "The bill, please.",
        "fr": "L’addition, s’il vous plaît.",
        "note": "bill = l’addition"
      },
      {
        "context": "Tu veux voir la carte.",
        "choices": [
          "Can we look the menu?",
          "Can we see the menu?"
        ],
        "answer": 1,
        "en": "Can we see the menu?",
        "fr": "Peut-on voir la carte ?",
        "note": "see the menu / look at the menu"
      },
      {
        "context": "Tu souhaites régler par carte.",
        "choices": [
          "Can I pay by card?",
          "Can I pay in card?"
        ],
        "answer": 0,
        "en": "Can I pay by card?",
        "fr": "Je peux payer par carte ?",
        "note": "by card / in cash"
      }
    ]
  },
  "narration": [
    {
      "start": 3,
      "text": "Que dis-tu au restaurant ?",
      "voice": "fr-FR-DeniseNeural",
      "role": "intro",
      "duration": 43,
      "src": "audio/production/4939b02cba495643.wav",
      "peaks": [
        0.0,
        0.0,
        0.0003,
        0.0001,
        0.0001,
        0.0002,
        0.0521,
        0.2144,
        0.8829,
        0.7072,
        0.3334,
        0.2197,
        0.2186,
        0.332,
        0.5397,
        0.5601,
        0.2363,
        0.0287,
        0.0307,
        0.2749,
        0.2941,
        0.2177,
        0.5367,
        0.7946,
        1.0,
        0.9352,
        0.7722,
        0.7837,
        0.7402,
        0.4376,
        0.2003,
        0.3959,
        0.6139,
        0.5698,
        0.3895,
        0.4646,
        0.6107,
        0.2732,
        0.0875,
        0.0226,
        0.032,
        0.2198,
        0.6952,
        0.6231,
        0.5825,
        0.3591,
        0.2067,
        0.3433,
        0.5217,
        0.5342,
        0.4302,
        0.2245,
        0.0723,
        0.0276,
        0.0103,
        0.0061,
        0.0016,
        0.0003,
        0.0002,
        0.0001
      ]
    },
    {
      "start": 266,
      "duration": 50,
      "src": "audio/production/1e1891dd2df75b00.wav",
      "text": "The bill, please.",
      "peaks": [
        0.0,
        0.0001,
        0.0001,
        0.0001,
        0.0005,
        0.0169,
        0.4215,
        1.0,
        0.5336,
        0.1611,
        0.031,
        0.0158,
        0.6057,
        0.7131,
        0.7134,
        0.6694,
        0.5698,
        0.4763,
        0.3647,
        0.255,
        0.2067,
        0.1613,
        0.1342,
        0.0937,
        0.0217,
        0.0031,
        0.0005,
        0.0002,
        0.0001,
        0.0002,
        0.0002,
        0.0002,
        0.0002,
        0.0003,
        0.0006,
        0.0526,
        0.0548,
        0.0664,
        0.5143,
        0.7257,
        0.5774,
        0.5291,
        0.4482,
        0.3443,
        0.2422,
        0.1922,
        0.1646,
        0.1116,
        0.057,
        0.069,
        0.0825,
        0.118,
        0.1096,
        0.0588,
        0.0151,
        0.0024,
        0.0006,
        0.0002,
        0.0001,
        0.0001
      ],
      "voice": "en-GB-SoniaNeural",
      "role": "lesson"
    },
    {
      "start": 521,
      "duration": 48,
      "src": "audio/production/639560d7c8314a6e.wav",
      "text": "Can we see the menu?",
      "peaks": [
        0.0,
        0.0,
        0.0001,
        0.0001,
        0.0002,
        0.106,
        0.1077,
        0.2665,
        0.6493,
        0.7759,
        0.8616,
        0.8529,
        0.8267,
        0.7803,
        0.8326,
        1.0,
        0.9762,
        0.7019,
        0.2649,
        0.3219,
        0.3967,
        0.3747,
        0.3128,
        0.4998,
        0.8379,
        0.7874,
        0.7093,
        0.7477,
        0.2865,
        0.0705,
        0.3468,
        0.7518,
        0.584,
        0.7163,
        0.7461,
        0.8226,
        0.723,
        0.7025,
        0.7275,
        0.7216,
        0.8577,
        0.8607,
        0.8158,
        0.7146,
        0.5867,
        0.5343,
        0.4692,
        0.4461,
        0.4028,
        0.3587,
        0.3003,
        0.2349,
        0.1754,
        0.0891,
        0.0099,
        0.0014,
        0.0005,
        0.0003,
        0.0001,
        0.0001
      ],
      "voice": "en-GB-SoniaNeural",
      "role": "lesson"
    },
    {
      "start": 776,
      "duration": 48,
      "src": "audio/production/d60a9ce47a440d96.wav",
      "text": "Can I pay by card?",
      "peaks": [
        0.0,
        0.0,
        0.0001,
        0.0002,
        0.0002,
        0.0994,
        0.1196,
        0.3074,
        0.6708,
        0.7464,
        1.0,
        0.8674,
        0.7808,
        0.751,
        0.7759,
        0.8743,
        0.565,
        0.0148,
        0.0042,
        0.0819,
        0.1261,
        0.4037,
        0.6253,
        0.7111,
        0.7753,
        0.8422,
        0.7206,
        0.0613,
        0.071,
        0.5178,
        0.5115,
        0.4653,
        0.4698,
        0.4117,
        0.1595,
        0.0108,
        0.004,
        0.1397,
        0.0795,
        0.2048,
        0.4066,
        0.442,
        0.4351,
        0.4421,
        0.4074,
        0.3539,
        0.3317,
        0.277,
        0.2432,
        0.2194,
        0.1418,
        0.0188,
        0.0573,
        0.0241,
        0.0112,
        0.0033,
        0.0005,
        0.0002,
        0.0001,
        0.0001
      ],
      "voice": "en-GB-SoniaNeural",
      "role": "lesson"
    },
    {
      "start": 861,
      "duration": 130,
      "src": "audio/production/07fe07394dca2591.wav",
      "text": "Bravo, tu as terminé cet exercice ! À bientôt !",
      "voice": "fr-FR-DeniseNeural",
      "peaks": [
        0.0002,
        0.0002,
        0.3088,
        0.4855,
        0.9756,
        0.468,
        0.4658,
        1.0,
        0.2724,
        0.0021,
        0.0002,
        0.0003,
        0.0006,
        0.1857,
        0.9098,
        0.8677,
        0.0703,
        0.7239,
        0.5711,
        0.8369,
        0.7797,
        0.7245,
        0.5527,
        0.7178,
        0.576,
        0.0928,
        0.5061,
        0.429,
        0.5351,
        0.4088,
        0.5506,
        0.5325,
        0.3779,
        0.6329,
        0.5989,
        0.1552,
        0.0162,
        0.0002,
        0.0001,
        0.0,
        0.0,
        0.0,
        0.0,
        0.0,
        0.0,
        0.0,
        0.0,
        0.0,
        0.0002,
        0.0003,
        0.9492,
        0.5837,
        0.3841,
        0.7765,
        0.3852,
        0.2796,
        0.7472,
        0.0995,
        0.0099,
        0.0002
      ],
      "role": "outro"
    }
  ]
}
