{
  "option": 4,
  "title": "Trois phrases à compléter.",
  "introText": "Quel verbe manque ?",
  "timing": {
    "introFrames": 60,
    "bodyFrames": 765,
    "outroFrames": 165,
    "pageFrames": 255,
    "answerAt": 165,
    "pauseAt": 45,
    "firstReveal": 150,
    "rowFrames": 90
  },
  "lessonData": {
    "gap": [
      {
        "before": "Can you",
        "after": "me a favor?",
        "answer": "do",
        "choices": [
          "make",
          "do"
        ],
        "en": "Can you do me a favor?",
        "fr": "Tu peux me rendre un service ?",
        "note": "do someone a favor"
      },
      {
        "before": "I need to",
        "after": "a decision.",
        "answer": "make",
        "choices": [
          "make",
          "do"
        ],
        "en": "I need to make a decision.",
        "fr": "Je dois prendre une décision.",
        "note": "make a decision"
      },
      {
        "before": "Let’s",
        "after": "a break.",
        "answer": "take",
        "choices": [
          "do",
          "take"
        ],
        "en": "Let’s take a break.",
        "fr": "Faisons une pause.",
        "note": "take a break"
      }
    ]
  },
  "narration": [
    {
      "start": 3,
      "text": "Quel verbe manque ?",
      "voice": "fr-FR-DeniseNeural",
      "role": "intro",
      "duration": 39,
      "src": "audio/production/ca41d0b2148080ed.wav",
      "peaks": [
        0.0,
        0.0002,
        0.0002,
        0.0002,
        0.0002,
        0.0002,
        0.0074,
        0.1046,
        1.0,
        0.9835,
        0.9364,
        0.7861,
        0.5819,
        0.4886,
        0.3169,
        0.2044,
        0.2428,
        0.852,
        0.9714,
        0.9615,
        0.9493,
        0.8512,
        0.7097,
        0.3264,
        0.3608,
        0.3238,
        0.2171,
        0.2262,
        0.5847,
        0.8662,
        0.6595,
        0.5959,
        0.654,
        0.6529,
        0.6155,
        0.6132,
        0.763,
        0.8936,
        0.7863,
        0.6842,
        0.5406,
        0.3543,
        0.1873,
        0.0824,
        0.0137,
        0.0023,
        0.0547,
        0.0943,
        0.1028,
        0.0623,
        0.0422,
        0.03,
        0.0245,
        0.0152,
        0.008,
        0.0018,
        0.0004,
        0.0002,
        0.0002,
        0.0002
      ]
    },
    {
      "start": 227,
      "duration": 49,
      "src": "audio/production/d8fa3b10c6b571a3.wav",
      "text": "Can you do me a favor?",
      "peaks": [
        0.0,
        0.0,
        0.0001,
        0.0001,
        0.0001,
        0.0556,
        0.0892,
        0.2409,
        0.6693,
        0.8586,
        0.9231,
        0.8777,
        0.8721,
        0.9338,
        0.9468,
        0.9785,
        1.0,
        0.3601,
        0.0472,
        0.1938,
        0.5236,
        0.7207,
        0.7762,
        0.7568,
        0.7939,
        0.814,
        0.7773,
        0.6666,
        0.6472,
        0.5518,
        0.5186,
        0.4191,
        0.1684,
        0.0531,
        0.0354,
        0.034,
        0.0272,
        0.1424,
        0.5554,
        0.5162,
        0.4963,
        0.5642,
        0.5422,
        0.5856,
        0.1721,
        0.033,
        0.0531,
        0.2537,
        0.2501,
        0.2075,
        0.1789,
        0.1593,
        0.1166,
        0.0618,
        0.0134,
        0.0026,
        0.0005,
        0.0003,
        0.0001,
        0.0001
      ],
      "voice": "en-GB-SoniaNeural",
      "role": "lesson"
    },
    {
      "start": 482,
      "duration": 54,
      "src": "audio/production/cafa72e5fcd6e2e7.wav",
      "text": "I need to make a decision.",
      "peaks": [
        0.0,
        0.0001,
        0.0001,
        0.0001,
        0.0003,
        0.2668,
        0.5326,
        0.6888,
        0.8311,
        0.9569,
        1.0,
        0.9856,
        0.9572,
        0.9999,
        0.9214,
        0.7789,
        0.1893,
        0.0038,
        0.2052,
        0.2911,
        0.2814,
        0.6192,
        0.862,
        0.8127,
        0.7593,
        0.639,
        0.6229,
        0.5189,
        0.0947,
        0.0127,
        0.093,
        0.423,
        0.341,
        0.0769,
        0.131,
        0.4053,
        0.3626,
        0.215,
        0.2029,
        0.2156,
        0.1871,
        0.4617,
        0.8076,
        0.648,
        0.2879,
        0.2866,
        0.2438,
        0.2343,
        0.3601,
        0.3654,
        0.2623,
        0.2203,
        0.1693,
        0.1086,
        0.0466,
        0.0066,
        0.0008,
        0.0003,
        0.0001,
        0.0001
      ],
      "voice": "en-GB-SoniaNeural",
      "role": "lesson"
    },
    {
      "start": 737,
      "duration": 44,
      "src": "audio/production/b242c89a57ae03de.wav",
      "text": "Let's take a break.",
      "peaks": [
        0.0,
        0.0,
        0.0001,
        0.0002,
        0.0002,
        0.0011,
        0.4605,
        0.8689,
        0.8839,
        0.996,
        0.864,
        0.514,
        0.0458,
        0.0113,
        0.0203,
        0.368,
        0.6846,
        0.7216,
        0.418,
        0.0328,
        0.2692,
        0.1717,
        0.6964,
        0.9345,
        0.9269,
        0.7649,
        0.4175,
        0.0298,
        0.0114,
        0.1872,
        0.4365,
        0.7656,
        0.3139,
        0.1613,
        0.0213,
        0.0833,
        0.7576,
        1.0,
        0.9719,
        0.8763,
        0.7547,
        0.7114,
        0.639,
        0.4597,
        0.3604,
        0.191,
        0.0901,
        0.005,
        0.0018,
        0.001,
        0.0385,
        0.0564,
        0.0472,
        0.0218,
        0.009,
        0.0028,
        0.0007,
        0.0003,
        0.0002,
        0.0001
      ],
      "voice": "en-GB-SoniaNeural",
      "role": "lesson"
    },
    {
      "start": 831,
      "duration": 130,
      "src": "audio/production/07fe07394dca2591.wav",
      "text": "Bravo, tu as terminé cet exercice ! À bientôt !",
      "voice": "fr-FR-DeniseNeural",
      "peaks": [
        0.0002,
        0.0002,
        0.3088,
        0.4855,
        0.9756,
        0.468,
        0.4658,
        1.0,
        0.2724,
        0.0021,
        0.0002,
        0.0003,
        0.0006,
        0.1857,
        0.9098,
        0.8677,
        0.0703,
        0.7239,
        0.5711,
        0.8369,
        0.7797,
        0.7245,
        0.5527,
        0.7178,
        0.576,
        0.0928,
        0.5061,
        0.429,
        0.5351,
        0.4088,
        0.5506,
        0.5325,
        0.3779,
        0.6329,
        0.5989,
        0.1552,
        0.0162,
        0.0002,
        0.0001,
        0.0,
        0.0,
        0.0,
        0.0,
        0.0,
        0.0,
        0.0,
        0.0,
        0.0,
        0.0002,
        0.0003,
        0.9492,
        0.5837,
        0.3841,
        0.7765,
        0.3852,
        0.2796,
        0.7472,
        0.0995,
        0.0099,
        0.0002
      ],
      "role": "outro"
    }
  ]
}
